File,Key,Value,Translation
BT Advanced Turrets/ammunitionBox/Ammo_AmmunitionBox_Generic_LT.json,Description.Details,"Ammo Bins contain the rounds needed for projectile-based weaponry, with at least one bin required per weapon type. Ammo Bins will explode and destroy their installed location when they receive a Critical Hit. Long Tom Ammo Bins each contain 5 rounds and may feed multiple weapons.","탄약 상자에는 발사체 기반 무기에 필요한 탄이 들어 있으며, 무기 유형마다 최소 하나의 탄약 상자가 필요합니다. 탄약 상자는 치명타를 받으면 폭발하여 장착된 부위를 파괴합니다. 롱 톰 탄약 상자 하나에는 탄 5발이 들어 있으며, 여러 무기에 탄을 공급할 수 있습니다."
BT Advanced Turrets/weapon/Weapon_Infantry_Flamer.json,Description.Details,"Flamer weapons are unique in that they deal little physical damage but instead expel superheated plasma, applying substantial heat to their target. When done properly, this can hamper enemy return fire or even cause the targeted unit to shut down from overheating.","플레이머 무장은 물리 피해는 적지만, 대신 초고열 플라스마를 분사해 목표물에 상당한 열을 가한다는 점에서 독특합니다. 제대로 사용하면 적의 반격 사격을 방해하거나, 심지어는 과열로 인해 표적 유닛을 셧다운시키는 것도 가능합니다."
BT Advanced Turrets/weapon/Weapon_Infantry_LRM.json,Description.Details,"The LRM10 rack of Long-Range Missiles occupies a supporting fire role when mounted on most units, with fairly low damage balanced by low heat and ammunition consumption. Like all LRMs, LRM10s are capable of indirect fire over obstacles and terrain with the benefit of a spotter unit.","장거리 미사일 LRM10 랙은 대부분의 유닛에 장착될 경우 지원 사격 역할을 수행하며, 비교적 낮은 피해량은 낮은 발열과 탄약 소모로 균형이 맞춰져 있습니다. 다른 모든 LRM과 마찬가지로, LRM10은 관측 유닛의 지원을 받으면 장애물과 지형 너머로 간접 사격이 가능합니다."
BT Advanced Turrets/weapon/Weapon_Infantry_Rifles.json,Description.Details,"A flexible weapon, AC/5s strike a balance between long range, power, and performance. These weapons are commonly found on medium 'Mechs as their primary source of reliable damage. Like all Autocannon weaponry, AC/5s suffer from recoil effects from continuous fire.","유연한 무기인 AC/5는 장거리 사거리, 화력, 성능 사이에서 균형을 이룹니다. 이 무기는 신뢰할 수 있는 주력 피해원으로서 미디엄 ’메크에 흔히 탑재됩니다. 모든 오토캐논 무기와 마찬가지로, AC/5는 지속 사격 시 반동의 영향을 받습니다."
BT Advanced Turrets/weapon/Weapon_Infantry_SRM.json,Description.Details,"The midtier rack of Short-Range Missiles, SRM4s deal good damage for comparatively few negatives other than their inherently short range and need for ammunition. As for all SRMs, SRM4 shots deal above-average stability impact per hit compared to other weapons.","중간급 단거리 미사일 랙인 SRM4는, 본래 사거리가 짧고 탄약이 필요하다는 점 외에는 비교적 단점이 적으면서도 준수한 피해를 가합니다. 모든 SRM과 마찬가지로, SRM4의 사격은 다른 무기에 비해 명중당 평균 이상의 안정성 피해를 줍니다."
