File,Key,Value,Translation
BT Advanced Core/settings/bonusDescriptions/BonusDescriptions_MechEngineer.json,Settings[300].Full,C3 Networks operate on channels. C3 slaves and masters must share a channel in order to be compatible with one another. This C3 equipment is on the {0} channel and only works with other C3 components on the same channel.,"C3 네트워크는 채널을 기반으로 작동합니다. C3 슬레이브와 마스터는 서로 호환되려면 동일한 채널을 사용해야 합니다. 이 C3 장비는 {0} 채널에 설정되어 있으며, 같은 채널의 다른 C3 구성 요소와만 작동합니다."
BT Advanced Core/settings/bonusDescriptions/BonusDescriptions_MechEngineer.json,Settings[301].Full,"C3 Networks are unit count limited. A single C3 Master can only support 3 Slaves connected to it. A C3 Network can have up to two Masters, both of which must be mounted on the same 'Mech. In a double Master network, the network can support up to 6 Slaves. Exceeding these unit limits will cause the network to collapse entirely, rendering it non-functional.","C3 네트워크는 유닛 수 제한이 있습니다. 하나의 C3 마스터는 최대 3개의 슬레이브만 지원할 수 있습니다. C3 네트워크에는 최대 2개의 마스터를 둘 수 있으며, 이들은 모두 동일한 멕에 장착되어야 합니다. 마스터가 2개인 네트워크는 최대 6개의 슬레이브를 지원할 수 있습니다. 이 유닛 수 제한을 초과하면 네트워크가 완전히 붕괴되어 작동하지 않게 됩니다."
BT Advanced Core/settings/bonusDescriptions/BonusDescriptions_MechEngineer.json,Settings[302].Full,C3 Master provides all C3-equipped units within {0} meters with {1} resolve gain.,C3 마스터는 반경 {0}미터 내 모든 C3 장착 유닛에게 {1}의 결의 획득 보너스를 제공합니다.
BT Advanced Core/settings/bonusDescriptions/BonusDescriptions_MechEngineer.json,Settings[303].Full,C3 Master provides all C3-equipped units within {0} meters with {1} evasion ignore on weapon attacks.,C3 마스터는 반경 {0}미터 내 모든 C3 장착 유닛에게 무기 공격 시 회피 무시 {1}을 제공합니다.
BT Advanced Core/settings/bonusDescriptions/BonusDescriptions_MechEngineer.json,Settings[304].Full,"C3i networks, unlike C3 networks, are hardened against ECM interference. C3i is not disabled when in range of an enemy ECM source.",C3i 네트워크는 일반 C3 네트워크와 달리 ECM 간섭에 강화되어 있습니다. C3i는 적 ECM 범위 내에서도 비활성화되지 않습니다.
BT Advanced Core/settings/bonusDescriptions/BonusDescriptions_MechEngineer.json,Settings[305].Full,"Improved C3 Network Unit - Connects unit to a C3i network, allowing it to share sensor data with other C3i-equipped units.",개량형 C3 네트워크 유닛 — 유닛을 C3i 네트워크에 연결하여 다른 C3i 장착 유닛들과 센서 데이터를 공유할 수 있게 합니다.
BT Advanced Core/settings/bonusDescriptions/BonusDescriptions_MechEngineer.json,Settings[306].Full,C3i Networks provide all C3i-equipped units with the best possible range accuracy to enemy targets based on the closest C3i-equipped unit in the network to the target. C3i networks do not have any unit count limitations and can support a network of any size.,"C3i 네트워크는 네트워크 내에서 해당 목표에 가장 가까운 C3i 장착 유닛을 기준으로, 모든 C3i 장착 유닛에게 최적의 사거리 명중률을 제공합니다. C3i 네트워크는 유닛 수 제한이 없으며, 어떤 규모의 네트워크도 지원할 수 있습니다."
BT Advanced Core/settings/bonusDescriptions/BonusDescriptions_MechEngineer.json,Settings[307].Full,C3i provides all C3i-equipped units within {0} meters with {1} resolve gain.,C3i는 반경 {0}미터 내 모든 C3i 장착 유닛에게 {1}의 결의 획득 보너스를 제공합니다.
BT Advanced Core/settings/bonusDescriptions/BonusDescriptions_MechEngineer.json,Settings[308].Full,C3i provides all C3i-equipped units within {0} meters with {1} accuracy on weapon attacks.,C3i는 반경 {0}미터 내 모든 C3i 장착 유닛에게 무기 공격 시 {1}의 명중 보너스를 제공합니다.
BT Advanced Core/settings/bonusDescriptions/BonusDescriptions_MechEngineer.json,Settings[309].Full,Drone Networks provide all drone-equipped units with the best possible range accuracy to enemy targets based on the closest drone-equipped unit in the network to the target. Drone networks do not have any unit count limitations and can support a network of any size.,"드론 네트워크는 네트워크 내에서 해당 목표에 가장 가까운 드론 장착 유닛을 기준으로, 모든 드론 장착 유닛에게 최적의 사거리 명중률을 제공합니다. 드론 네트워크는 유닛 수 제한이 없으며 어떤 규모의 네트워크도 지원할 수 있습니다."
BT Advanced Core/settings/bonusDescriptions/BonusDescriptions_MechEngineer.json,Settings[30].Full,Telos LRM are more Accurate but more likely to be intercepted by AMS,텔로스 LRM은 명중률이 더 높지만 안티 미사일 시스템에 요격될 확률도 더 높습니다.
BT Advanced Core/settings/bonusDescriptions/BonusDescriptions_MechEngineer.json,Settings[310].Full,Nova Combined Electronic Warfare System combines a C3 Network unit with Advanced ECM and Sensor Suites - Shares Sensor Information,노바 통합 전자전 시스템은 고급 ECM 및 센서 장비가 결합된 C3 네트워크 유닛입니다 — 센서 정보를 공유합니다.
BT Advanced Core/settings/bonusDescriptions/BonusDescriptions_MechEngineer.json,Settings[311].Full,Take pilot damage on overheat,과열 시 조종사가 피해를 입습니다.
BT Advanced Core/settings/bonusDescriptions/BonusDescriptions_MechEngineer.json,Settings[312].Full,Take pilot damage on 'mech shutdown,멕이 셧다운되면 조종사가 피해를 입습니다.
BT Advanced Core/settings/bonusDescriptions/BonusDescriptions_MechEngineer.json,Settings[313].Full,This TTS allows Artemis IV Ammo to be used,이 TTS는 아르테미스 IV 탄약 사용을 가능하게 합니다.
BT Advanced Core/settings/bonusDescriptions/BonusDescriptions_MechEngineer.json,Settings[314].Full,This TTS allows Apollo Ammo to be used,이 TTS는 아폴로 탄약 사용을 가능하게 합니다.
BT Advanced Core/settings/bonusDescriptions/BonusDescriptions_MechEngineer.json,Settings[315].Full,Can be used with Artemis IV System,아르테미스 IV 시스템과 함께 사용할 수 있습니다.
BT Advanced Core/settings/bonusDescriptions/BonusDescriptions_MechEngineer.json,Settings[316].Full,Requires an ECM system to be installed,ECM 시스템이 장착되어 있어야 합니다.
BT Advanced Core/settings/bonusDescriptions/BonusDescriptions_MechEngineer.json,Settings[317].Full,Requires an Inner Sphere ECM system to be installed. Clan/Sanctuary ECM is incompatible.,이너스피어 ECM 시스템이 장착되어 있어야 합니다. 클랜/생츄어리 ECM과는 호환되지 않습니다.
BT Advanced Core/settings/bonusDescriptions/BonusDescriptions_MechEngineer.json,Settings[318].Full,Requires Partial Wings system to be installed,부분 날개 시스템이 장착되어 있어야 합니다.
BT Advanced Core/settings/bonusDescriptions/BonusDescriptions_MechEngineer.json,Settings[319].Full,Requires Artemis IV system to be installed,아르테미스 IV 시스템이 장착되어 있어야 합니다.
BT Advanced Core/settings/bonusDescriptions/BonusDescriptions_MechEngineer.json,Settings[31].Full,Zeus LRM have improved Damage but have a chance to Jam,제우스 LRM은 피해량이 향상된 대신 오작동할 확률이 있습니다.
BT Advanced Core/settings/bonusDescriptions/BonusDescriptions_MechEngineer.json,Settings[320].Full,Weapon carries {0} rounds of internal ammo.,이 무장은 내부 탄약 {0}발을 탑재하고 있습니다.
BT Advanced Core/settings/bonusDescriptions/BonusDescriptions_MechEngineer.json,Settings[321].Full,Exposed Ammo feed can explode for {0} Damage,노출된 탄약 공급 장치는 폭발 시 {0}의 피해를 줄 수 있습니다.
BT Advanced Core/settings/bonusDescriptions/BonusDescriptions_MechEngineer.json,Settings[322].Full,This component explodes for {0} damage when destroyed,이 구성 요소는 파괴될 경우 {0}의 피해를 일으키며 폭발합니다.
BT Advanced Core/settings/bonusDescriptions/BonusDescriptions_MechEngineer.json,Settings[323].Full,Internal AMS feed can explode for {0} Damage,내부 AMS 탄약 공급 장치는 폭발 시 {0}의 피해를 줄 수 있습니다.
BT Advanced Core/settings/bonusDescriptions/BonusDescriptions_MechEngineer.json,Settings[324].Full,High-Pressure Tanks can explode for {0} Damage,고압 탱크는 폭발 시 {0}의 피해를 줄 수 있습니다.
BT Advanced Core/settings/bonusDescriptions/BonusDescriptions_MechEngineer.json,Settings[325].Full,Pressurized Coolant can explode for {0} Heat and 50% of that as Damage and Stability,"가압 냉각제는 폭발 시 {0}의 열을 발생시키고, 그중 50%를 피해와 안정성 피해로 전환합니다."
BT Advanced Core/settings/bonusDescriptions/BonusDescriptions_MechEngineer.json,Settings[326].Full,Pressurized Coolant can explode for {0} Heat and 33% of that as Damage and Stability,"가압 냉각제는 폭발 시 {0}의 열을 발생시키고, 그중 33%를 피해와 안정성 피해로 전환합니다."
BT Advanced Core/settings/bonusDescriptions/BonusDescriptions_MechEngineer.json,Settings[327].Full,"Pressurized Coolant can explode for {0} Heat, Damage and Stability","가압 냉각제는 폭발 시 {0}의 열, 피해, 안정성 피해를 유발합니다."
BT Advanced Core/settings/bonusDescriptions/BonusDescriptions_MechEngineer.json,Settings[328].Full,Weapon damage increases to {0} of its starting value at long range.,이 무기의 피해량은 장거리에서 기본 수치의 {0}까지 증가합니다.
BT Advanced Core/settings/bonusDescriptions/BonusDescriptions_MechEngineer.json,Settings[329].Full,Weapon damage begins to increasing starting at {0} meters.,이 무기의 피해량 증가는 {0}미터부터 시작됩니다.
BT Advanced Core/settings/bonusDescriptions/BonusDescriptions_MechEngineer.json,Settings[32].Full,Holly SRM are more Accurate but more likely to be intercepted by AMS,홀리 SRM은 명중률이 더 높지만 안티 미사일 시스템에 요격될 확률도 더 높습니다.
BT Advanced Core/settings/bonusDescriptions/BonusDescriptions_MechEngineer.json,Settings[330].Full,Weapon damage stops increasing starting at {0} meters.,이 무기의 피해량 증가는 {0}미터부터 더 이상 증가하지 않습니다.
BT Advanced Core/settings/bonusDescriptions/BonusDescriptions_MechEngineer.json,Settings[331].Full,Weapon damage falls off to {0} of its starting value at long range.,이 무기의 피해량은 장거리에서 기본 수치의 {0}까지 감소합니다.
BT Advanced Core/settings/bonusDescriptions/BonusDescriptions_MechEngineer.json,Settings[332].Full,Weapon damage begins to falloff starting at {0} meters.,이 무기의 피해량 감소는 {0}미터부터 시작됩니다.
BT Advanced Core/settings/bonusDescriptions/BonusDescriptions_MechEngineer.json,Settings[333].Full,Weapon damage stops falling off starting at {0} meters.,이 무기의 피해량 감소는 {0}미터부터 더 이상 감소하지 않습니다.
BT Advanced Core/settings/bonusDescriptions/BonusDescriptions_MechEngineer.json,Settings[334].Full,Weapon damage falls off to {0} of its starting value at long range when switched to its secondary mode.,이 무기의 피해량은 보조 모드로 전환 시 장거리에서 기본 수치의 {0}까지 감소합니다.
BT Advanced Core/settings/bonusDescriptions/BonusDescriptions_MechEngineer.json,Settings[335].Full,Weapon damage begins to falloff starting at {0} meters when switched to its secondary mode.,보조 모드로 전환 시 이 무기의 피해량 감소는 {0}미터부터 시작됩니다.
BT Advanced Core/settings/bonusDescriptions/BonusDescriptions_MechEngineer.json,Settings[336].Full,Weapon damage stops falling off starting at {0} meters when switched to its secondary mode.,보조 모드로 전환 시 이 무기의 피해량 감소는 {0}미터부터 더 이상 감소하지 않습니다.
BT Advanced Core/settings/bonusDescriptions/BonusDescriptions_MechEngineer.json,Settings[337].Full,Weapon damage increases with distance to the target up to {0},이 무기의 피해량은 목표와의 거리에 따라 최대 {0}까지 증가합니다.
BT Advanced Core/settings/bonusDescriptions/BonusDescriptions_MechEngineer.json,Settings[338].Full,Weapon deals {0}% reduced damage the closer it gets to the target,이 무기는 목표에 가까워질수록 피해량이 {0}% 감소합니다.
BT Advanced Core/settings/bonusDescriptions/BonusDescriptions_MechEngineer.json,Settings[339].Full,Weapon's damage can vary between +/- {0},이 무기의 피해량은 ±{0} 범위 내에서 변동될 수 있습니다.
BT Advanced Core/settings/bonusDescriptions/BonusDescriptions_MechEngineer.json,Settings[33].Full,Irian SRM have reduced Accuracy but are less likely to be intercepted by AMS,이리안 SRM은 명중률이 낮은 대신 안티 미사일 시스템에 요격될 확률이 낮습니다.
BT Advanced Core/settings/bonusDescriptions/BonusDescriptions_MechEngineer.json,Settings[340].Full,Cockpit provides immunity against Head shots,이 콕핏은 헤드샷에 대한 면역을 제공합니다.
BT Advanced Core/settings/bonusDescriptions/BonusDescriptions_MechEngineer.json,Settings[341].Full,Cockpit is mounted in Center Torso,이 콕핏은 센터 토르소에 장착됩니다.
BT Advanced Core/settings/bonusDescriptions/BonusDescriptions_MechEngineer.json,Settings[342].Full,Takes the cockpit slot.,콕핏 슬롯을 차지합니다.
BT Advanced Core/settings/bonusDescriptions/BonusDescriptions_MechEngineer.json,Settings[343].Full,Takes the upper sensor slot.,상부 센서 슬롯을 차지합니다.
BT Advanced Core/settings/bonusDescriptions/BonusDescriptions_MechEngineer.json,Settings[344].Full,Takes the lower sensor slot.,하부 센서 슬롯을 차지합니다.
BT Advanced Core/settings/bonusDescriptions/BonusDescriptions_MechEngineer.json,Settings[345].Full,Takes the upper life support slot.,상부 생명 유지 장치 슬롯을 차지합니다.
BT Advanced Core/settings/bonusDescriptions/BonusDescriptions_MechEngineer.json,Settings[346].Full,Takes the lower life support slot.,하부 생명 유지 장치 슬롯을 차지합니다.
BT Advanced Core/settings/bonusDescriptions/BonusDescriptions_MechEngineer.json,Settings[347].Full,"The Virtual Reality Piloting Pod provides extreme benefits while piloting a 'Mech including excellent accuracy and mobility but is highly vulnerable to enemy ECM effects, even certain severe weather conditions such as solar storms.","가상 현실 조종 포드는 멕 조종 시 뛰어난 명중률과 기동성을 포함한 극단적인 이점을 제공하지만, 적 ECM 효과 및 태양 폭풍과 같은 일부 극심한 기상 조건에도 매우 취약합니다."
BT Advanced Core/settings/bonusDescriptions/BonusDescriptions_MechEngineer.json,Settings[348].Full,"This is a Direct Neural Interface cockpit, providing increased control over the 'Mech (and thus granting a wide variety of benefits) but coming with a risk of suffering pilot injuries from incoming structure damage.","이것은 직접 신경 인터페이스 콕핏으로, 멕에 대한 제어력이 향상되어 다양한 이점을 제공하지만 구조물 피해를 받을 경우 조종사가 부상을 입을 위험이 있습니다."
BT Advanced Core/settings/bonusDescriptions/BonusDescriptions_MechEngineer.json,Settings[349].Full,Enables the targeting of specific locations during Precise Strikes.,정밀 타격 시 특정 부위를 지정하여 조준할 수 있게 합니다.
BT Advanced Core/settings/bonusDescriptions/BonusDescriptions_MechEngineer.json,Settings[34].Full,Valiant SRM have improved Damage but are less Heat Efficient,발리언트 SRM은 피해량이 향상된 대신 열 효율이 낮습니다.
BT Advanced Core/settings/bonusDescriptions/BonusDescriptions_MechEngineer.json,Settings[350].Full,Weapon is able to fire during Melee combat,이 무기는 근접 전투 중에도 사격할 수 있습니다.
BT Advanced Core/settings/bonusDescriptions/BonusDescriptions_MechEngineer.json,Settings[351].Full,Weapon carries internal Ammo for a single salvo,이 무기는 단 한 번의 일제 사격에 사용할 내부 탄약을 보유하고 있습니다.
BT Advanced Core/settings/bonusDescriptions/BonusDescriptions_MechEngineer.json,Settings[352].Full,"True artillery weapons have a unique attack sequence. When a target is selected, the attack is programmed in targeting that location (not a unit but the place the unit is standing) and the artillery unit enters an artillery stance and ends its turn. On the artillery unit's next turn, it can either brace (exiting the artillery stance and canceling the attack) or it can fire, completing the attack against the targeted location. Artillery weapons target the ground, not individual units, and do not track if units move out of the blast radius.","진정한 포병 무기는 고유한 공격 절차를 가집니다. 목표를 선택하면 해당 위치(유닛이 아니라 유닛이 서 있는 지점)를 조준하도록 사격이 설정되고, 포병 유닛은 포병 자세에 들어가며 턴을 종료합니다. 다음 턴에 포병 유닛은 방어 태세로 전환하여 포병 자세를 해제하고 공격을 취소하거나, 사격을 수행하여 지정된 위치에 대한 공격을 완료할 수 있습니다. 포병 무기는 지면을 목표로 하며 개별 유닛을 추적하지 않으므로, 유닛이 폭발 반경 밖으로 이동하더라도 이를 추적하지 않습니다."
BT Advanced Core/settings/bonusDescriptions/BonusDescriptions_MechEngineer.json,Settings[353].Full,"True artillery weapons have a secondary attack sequence, called a guided attack. This attack mode only works with specialized ammunition (such as Homing Arrow IV ammo or Copperhead ammo for the tube artillery). A guided artillery attack works like normal weapons, firing immediately without delay, but can only be effectively performed against targets painted by TAG, as otherwise the ammunition cannot get a lock on the target and thus will miss harmlessly.","진정한 포병 무기는 유도 공격이라 불리는 보조 공격 절차를 가지고 있습니다. 이 공격 모드는 특수 탄약(예: 호밍 애로우 IV 탄약 또는 튜브 포병용 코퍼헤드 탄약)에서만 작동합니다. 유도 포병 공격은 일반 무기처럼 지연 없이 즉시 발사되지만, TAG로 표식된 목표에 대해서만 효과적으로 수행할 수 있습니다. 그렇지 않으면 탄약이 목표를 고정할 수 없어 빗나가 무해하게 떨어집니다."
BT Advanced Core/settings/bonusDescriptions/BonusDescriptions_MechEngineer.json,Settings[354].Full,"Because of the special artillery attack, artillery weapons do not use accuracy as a statistic and are completely incapable of direct hits against targets (even stationary ones), only dealing AoE damage, instability damage, and heat damage. Artillery weapons do generate heat but only the turn they actually fire. Artillery weapons do not follow targets and do not make attacks against targets directly, instead functioning like Attack Ground in all situations.","포병의 특수 공격 방식 때문에, 포병 무기는 명중률 수치를 사용하지 않으며 정지한 목표를 포함해 어떠한 대상에게도 직격을 가할 수 없습니다. 대신 광역 피해, 안정성 피해, 열 피해만 가합니다. 포병 무기도 열을 발생시키지만 실제로 사격한 턴에만 열이 발생합니다. 포병 무기는 목표를 추적하지 않으며 개별 유닛을 직접 공격하지 않고, 모든 상황에서 지면 공격처럼 작동합니다."
BT Advanced Core/settings/bonusDescriptions/BonusDescriptions_MechEngineer.json,Settings[355].Full,"If a mech that mounts this weapon also mounts other, non-artillery, weapons, they do not fire during an artillery attack. In order to use non-artillery weapons on a mech that mounts this weapon, disable this weapon in the weapons panel. If this weapon is active, it will override all other non-artillery weapons and perform an artillery attack.","이 무기를 장착한 멕이 다른 비포병 무기도 함께 장착한 경우, 포병 공격을 수행할 때 그 무기들은 발사되지 않습니다. 해당 멕에서 비포병 무기를 사용하려면 무기 패널에서 이 무기를 비활성화해야 합니다. 이 무기가 활성화된 상태에서는 다른 모든 비포병 무기를 무시하고 포병 공격을 수행합니다."
BT Advanced Core/settings/bonusDescriptions/BonusDescriptions_MechEngineer.json,Settings[356].Full,Artillery weapons are siege weapons and are incredibly heavy with excellent area of effect damage. They have a unique firing sequence that takes two turns to complete and they require a special hardpoint in order to mount.,"포병 무기는 공성 무기로, 엄청난 중량과 뛰어난 광역 피해를 자랑합니다. 고유한 발사 절차로 인해 공격 완료까지 2턴이 소요되며, 장착하려면 전용 하드포인트가 필요합니다."
BT Advanced Core/settings/bonusDescriptions/BonusDescriptions_MechEngineer.json,Settings[357].Full,Artillery Cannon weapons are sawn-off versions of the true artillery weapons and are very heavy with moderate damage and high damage variance. They have both a direct-fire mode and an indirect-fire mode and use their own ammunition category. They require a special hardpoint in order to mount.,"포병 캐논 무기는 진정한 포병 무기를 절단한 형태로, 매우 무겁고 피해량은 중간 수준이지만 피해 편차가 큽니다. 직사 모드와 간접 사격 모드를 모두 가지며, 자체 전용 탄약을 사용합니다. 장착하려면 전용 하드포인트가 필요합니다."
BT Advanced Core/settings/bonusDescriptions/BonusDescriptions_MechEngineer.json,Settings[358].Full,Davy Crockett Tactical Nuclear Missiles are launched from an Arrow IV launcher and are capable of eradicating anything in a massive area. The Davy Crockett also leaves radioactive fallout behind after its initial strike.,"데이비 크로켓 전술 핵미사일은 애로우 IV 발사기에서 발사되며, 광범위한 지역의 모든 것을 제거할 수 있습니다. 또한 초기 폭발 이후 방사능 낙진을 남깁니다."
BT Advanced Core/settings/bonusDescriptions/BonusDescriptions_MechEngineer.json,Settings[359].Full,Fires a single salvo of {0} unguided Rockets,유도되지 않은 로켓 {0}발을 한 번에 발사합니다.
BT Advanced Core/settings/bonusDescriptions/BonusDescriptions_MechEngineer.json,Settings[35].Full,Exostar Lasers have improved Accuracy but generate more Heat,엑소스타 레이저는 명중률이 향상된 대신 열 발생이 증가합니다.
BT Advanced Core/settings/bonusDescriptions/BonusDescriptions_MechEngineer.json,Settings[360].Full,Mortars are capable to fire a wide range of munitions and will not be intercepted by AMS,박격포는 다양한 탄종을 사용할 수 있으며 안티 미사일 시스템에 의해 요격되지 않습니다.
BT Advanced Core/settings/bonusDescriptions/BonusDescriptions_MechEngineer.json,Settings[361].Full,Fires a single salvo of {0} unguided Inferno Rockets,유도되지 않은 인페르노 로켓 {0}발을 한 번에 발사합니다.
BT Advanced Core/settings/bonusDescriptions/BonusDescriptions_MechEngineer.json,Settings[362].Full,Fires a single devastating Guided Missile,강력한 유도 미사일 1발을 발사합니다.
BT Advanced Core/settings/bonusDescriptions/BonusDescriptions_MechEngineer.json,Settings[363].Full,Fires a single Thermobaric Thunderbolt Missile,열압력 썬더볼트 미사일 1발을 발사합니다.
BT Advanced Core/settings/bonusDescriptions/BonusDescriptions_MechEngineer.json,Settings[364].Full,Plasma weapons fire superheated material capable of delivering a powerful thermal and kinetic impact,플라즈마 무기는 강력한 열 및 운동 충격을 가할 수 있는 초고온 물질을 발사합니다.
BT Advanced Core/settings/bonusDescriptions/BonusDescriptions_MechEngineer.json,Settings[365].Full,Machine Guns are large caliber rapid-fire weapons with multiple firing modes that increase ROF but cause Recoil and Jams,"기관총은 대구경 연사 무기로 여러 사격 모드를 가지며, 발사 속도를 높일 수 있지만 반동과 오작동을 유발합니다."
BT Advanced Core/settings/bonusDescriptions/BonusDescriptions_MechEngineer.json,Settings[366].Full,Gauss Rifles are low-Heat long-range high-Damage ballistic weapons,가우스 라이플은 열 발생이 적고 사거리가 길며 피해량이 높은 탄도 무기입니다.
BT Advanced Core/settings/bonusDescriptions/BonusDescriptions_MechEngineer.json,Settings[367].Full,"Heavy Gauss Rifles are scaled up Gauss Rifles. However, the Heavy Gauss has three range bands it operates it and gains damage and accuracy at closer range bands and loses damage and accuracy at longer range bands.","헤비 가우스 라이플은 가우스 라이플을 대형화한 무기입니다. 다만 세 가지 사거리 구간에 따라 성능이 달라지며, 근거리에서는 피해와 명중률이 증가하고 장거리에서는 감소합니다."
BT Advanced Core/settings/bonusDescriptions/BonusDescriptions_MechEngineer.json,Settings[368].Full,AP Gauss Rifles fire a barrage of {0} small Projectiles,AP 가우스 라이플은 소형 발사체 {0}발을 일제 사격합니다.
